{
  "id": "quote_eth_01",
  "protocol_version": "greenrails.settlement.v1",
  "mock": true,
  "display_notice": "MOCK SETTLEMENT · NO FUNDS WILL MOVE",
  "idempotency_key": "grn-eth-0001",
  "buyer": {
    "id": "buyer_mock_03",
    "role": "buyer",
    "wallet": "0xBUYER000000000000000000000000000000000001",
    "wallet_chain": "ethereum"
  },
  "seller": {
    "id": "seller_mock_01",
    "role": "seller",
    "wallet": "0xSELLER00000000000000000000000000000000001",
    "wallet_chain": "ethereum",
    "payout_wallet": "0xSELLERBASE000000000000000000000000000001"
  },
  "listing": {
    "id": "listing_mock_01",
    "nft": {
      "chain": "ethereum",
      "contract": "0xLEGACY000000000000000000000000000000000001",
      "token_id": "1042",
      "owner_at_quote": "0xSELLER00000000000000000000000000000000001",
      "collection": "Legacy Genesis"
    }
  },
  "input": {
    "kind": "crypto",
    "asset": "ETH",
    "amount": "0.0150",
    "rail": "ethereum_eth",
    "chain": "ethereum"
  },
  "xents_output": {
    "asset": "XENTS",
    "chain": "base",
    "amount": "1000",
    "route_provider": "mock-router",
    "route_digest": "sha256:mock-route-digest-0001"
  },
  "usdc_payout": {
    "asset": "USDC",
    "chain": "base",
    "amount": "40.00",
    "destination": "0xSELLERBASE000000000000000000000000000001",
    "liquidity_source": "mock-liquidity-pool"
  },
  "fees": [
    {
      "code": "network",
      "payer": "buyer",
      "asset": "ETH",
      "amount": "0.0002"
    },
    {
      "code": "routing",
      "payer": "buyer",
      "asset": "XENTS",
      "amount": "5"
    },
    {
      "code": "platform",
      "payer": "seller",
      "asset": "USDC",
      "amount": "2.00"
    }
  ],
  "timeouts": {
    "quote_ttl_seconds": 300,
    "input_authorization_seconds": 900,
    "nft_transfer_seconds": 1800,
    "usdc_payout_seconds": 900
  },
  "confirmation_thresholds": {
    "nft_chain_confirmations": 12,
    "base_confirmations": 6,
    "input_chain_confirmations": 6
  },
  "created_at": "2026-09-08T12:00:00Z",
  "expires_at": "2026-09-08T12:05:00Z",
  "quote_digest": "sha256:quote_eth_01-digest"
}
